[
  {
    "id": "01",
    "title": "Toxic Shame",
    "description": "What you feel is not ordinary guilt for having done something wrong. It is a bone-deep sense that you yourself are wrong, bad, and undeserving of love.",
    "mechanism": "When an emotional flashback is triggered, toxic shame often becomes the strongest and most central feeling. It frequently originates from early experiences of contempt, neglect, or verbal injury.",
    "healingDirection": "Quiet the inner critic and practice self-compassion. Interrupt self-attack with healthy boundaries, and respond to the wounded part with your adult self.",
    "safePractice": "When the self-attacking voice appears, gently label it: \"This is the inner critic.\" Place a hand on your chest and say: \"I am willing to begin treating myself differently.\""
  },
  {
    "id": "02",
    "title": "Fear in Emotional Flashback",
    "description": "A single sentence or glance suddenly pulls you back into that small, frightened feeling. Your body reacts before your mind does—you want to flee or shrink.",
    "mechanism": "When old fear is triggered by the present situation, the nervous system rapidly enters high arousal, producing intense unease or even panic.",
    "healingDirection": "First recognize \"this may be an old wound being triggered,\" then use grounding to bring the body back to the present and build a sense that \"I am safe now.\"",
    "safePractice": "Press both feet firmly into the ground. Slowly exhale while counting to four. Repeat several times, then quietly say: \"I am safe now. This is a memory.\""
  },
  {
    "id": "03",
    "title": "Despair in Emotional Flashback",
    "description": "It feels like falling into a deep well—nothing you do will matter, nothing will get better. Your body wants to hide or becomes heavy and numb.",
    "mechanism": "When despair becomes the main triggered feeling, people often enter a state of deep powerlessness and the urge to withdraw.",
    "healingDirection": "Recognize that this is old helplessness being activated, not the whole of present reality. Use the smallest possible action to restore a little sense of \"I can still choose.\"",
    "safePractice": "Write down \"I am still here,\" then do one tiny completable thing (drink water, open a window, stand and take two steps)."
  },
  {
    "id": "04",
    "title": "Helplessness & Powerlessness",
    "description": "You feel you can do nothing, as if pinned in place. You know what should be done yet cannot move.",
    "mechanism": "During intense emotional activation, people often re-experience the smallness and powerlessness of childhood. Trauma also weakens the sense that \"I can influence outcomes.\"",
    "healingDirection": "Rebuild agency through tiny choices that are fully under your control.",
    "safePractice": "Move a finger or a toe. Feel \"I can still control this small part of my body,\" then do one small thing decided entirely by you."
  },
  {
    "id": "05",
    "title": "Small, Young & Vulnerable",
    "description": "Suddenly you feel very small and young, like a child who needs protection yet has no one to protect them.",
    "mechanism": "When old wounds are triggered, body and mind easily regress to the state of early threat.",
    "healingDirection": "Respond to that young part with your adult self, letting it know \"I am here now.\"",
    "safePractice": "Gently place a hand on your heart or arm and say to the young part inside: \"I see you. I am here.\""
  },
  {
    "id": "06",
    "title": "Abandonment Depression",
    "description": "When things grow quiet, emptiness and pain rise up—like reaching the dead end of a blind alley, helpless and hopeless.",
    "mechanism": "This deep emptiness and pain often relate to early emotional neglect or abandonment, and surface more easily when alone.",
    "healingDirection": "Keep company with the emptiness instead of rushing to fill or escape it. Allow the process of mourning to unfold slowly.",
    "safePractice": "Place a hand on your chest and say: \"I am willing to stay with this emptiness rather than immediately flee or fill it.\" Allow yourself a few quiet moments."
  },
  {
    "id": "07",
    "title": "Complex Abandonment",
    "description": "Shame, fear and melancholy tangle together, making you both want closeness and want to run. The inside feels chaotic.",
    "mechanism": "When multiple old emotions are triggered at once, people often fall into the contradiction of longing for connection while fearing injury.",
    "healingDirection": "Name the feelings first, then look at them separately instead of being overwhelmed by the whole mass.",
    "safePractice": "On paper write \"shame,\" \"fear,\" and \"melancholy\" separately, then tell yourself: \"They can exist at the same time. For now I am only looking.\""
  },
  {
    "id": "08",
    "title": "Self-Hatred / Self-Loathing",
    "description": "It is not merely dislike of yourself. It is a visceral aversion and the urge to attack yourself.",
    "mechanism": "When the inner critic becomes extreme, people develop intense aversion and aggression toward themselves.",
    "healingDirection": "Identify and label the inner critic, and redirect the aggression away from yourself.",
    "safePractice": "When self-attack appears, clearly say: \"This is the inner critic.\" Then place a hand on your chest and remind yourself: \"I deserve to be treated more gently.\""
  },
  {
    "id": "09",
    "title": "Self-Abandonment",
    "description": "You always put others first. You may not even notice when you are hungry, tired or in pain—essentially abandoning yourself.",
    "mechanism": "If you were long neglected early on, it is easy to learn to satisfy others first and lose awareness of your own needs.",
    "healingDirection": "Re-learn to bring \"yourself\" back into view, starting with small bodily signals.",
    "safePractice": "Ask yourself three questions: \"Am I hungry? Tired? Do I need rest?\" Then respond to at least one of them."
  },
  {
    "id": "10",
    "title": "Inner Critic Attack",
    "description": "That voice in your head that constantly finds fault and says you are not good enough is often the internalization of early criticism.",
    "mechanism": "The inner critic usually comes from the attitudes of important early figures. It tries to \"protect\" you by attacking you, at the cost of ongoing self-depletion.",
    "healingDirection": "Notice its appearance with mindfulness, then interrupt it with gentle firmness.",
    "safePractice": "When it appears, first name it \"This is the inner critic,\" then interrupt with a short sentence: \"I do not need to treat myself this way.\""
  },
  {
    "id": "11",
    "title": "Social Anxiety",
    "description": "In front of others you constantly feel scrutinized, fear saying the wrong thing, fear being seen through as \"not good enough.\"",
    "mechanism": "When shame is strong, attention in social settings easily focuses excessively on \"how others see me.\"",
    "healingDirection": "Lower the catastrophic expectation of being \"found out,\" while building new experience through small doses of authentic exposure.",
    "safePractice": "Prepare one simple opening line or exit phrase in advance to reduce the fear of the unknown."
  },
  {
    "id": "12",
    "title": "Shame-Based Anger",
    "description": "Anger that rises quickly when you feel exposed, criticized or small—often a secondary reaction to underlying shame.",
    "mechanism": "When toxic shame is activated, anger can surge as a way to regain a sense of power or to push the threat away.",
    "healingDirection": "Look beneath the anger for the shame or fear it is protecting, and respond to that deeper layer.",
    "safePractice": "When anger flares, pause and ask: \"What just made me feel small or exposed?\" Name that softer feeling first."
  },
  {
    "id": "13",
    "title": "Anger & Aggression",
    "description": "A surge of heat, the urge to push back, control, or strike—whether expressed outward or turned inward.",
    "mechanism": "Anger is a boundary-protecting emotion. In trauma it may become either chronically suppressed or easily explosive.",
    "healingDirection": "Allow anger to exist as information about boundaries, and find safe ways to express or channel it.",
    "safePractice": "In a private, safe space (journal, shower, alone), allow yourself to speak the angry words without having to justify them."
  },
  {
    "id": "14",
    "title": "Freeze Response",
    "description": "You know you should act, flee or speak, yet the body feels pinned and unable to move. Energy is stuck.",
    "mechanism": "Freeze is a survival response. Uncompleted fight-or-flight energy can remain held in the body.",
    "healingDirection": "Respect the freeze. Do not force movement. Gently mobilize only when the body shows readiness.",
    "safePractice": "Allow yourself to stay still at first and simply breathe. When the body feels even a little ready, make the smallest possible movement."
  },
  {
    "id": "15",
    "title": "Overwhelm / Collapse",
    "description": "You feel you are about to fall apart. Emotion, pressure and fatigue surge together; you want to cry or drop.",
    "mechanism": "When the nervous system exceeds its window of tolerance, collapse or overwhelm can appear as a protective shutdown.",
    "healingDirection": "Reduce input, restore basic safety and regulation, then return to one small manageable piece.",
    "safePractice": "Stop adding new tasks. Sit or lie down. Name three things you can see right now. Breathe out longer than you breathe in."
  },
  {
    "id": "16",
    "title": "Numbing & Dissociation",
    "description": "You are not \"over it\"—you feel switched off. Joy and sadness both become muted, as if behind a layer of cotton.",
    "mechanism": "To survive unbearable pain, the nervous system may turn down the volume on feeling.",